{
  "schema_version": "1.0.0",
  "bundle_code": "lead_conversion_pack",
  "name": "Lead Conversion Pack",
  "tagline": "Stop leaking leads.",
  "description": "Instant acknowledgment, missed-call recovery, speed-to-lead dispatch, and estimate follow-up — the four automations that most service businesses lose revenue without.",
  "outcome": "Respond faster and convert more of the leads you already have.",
  "modules": [
    "missed_call_textback",
    "webform_autoreply",
    "instant_lead_ack",
    "speed_to_lead_response",
    "estimate_followup"
  ],
  "price_monthly": 79,
  "implied_savings_monthly": 16,
  "recommended_for_personas": ["owner-operator", "office-manager", "sales-coordinator"],
  "recommended_for_blueprints": ["plumbing", "hvac", "electrical", "pest-control", "cleaning"],
  "hero_kpi": "First response time p95",
  "status": "spec"
}
